{
  "$schema": "http://json-schema.org/draft-07/schema#",
  "title": "JSON schema for MoonBit moon.mod.json files",
  "description": "A module of MoonBit lang",
  "type": "object",
  "required": [
    "name"
  ],
  "properties": {
    "--moonbit-unstable-prebuild": {
      "description": "**Experimental:** A relative path to the pre-build configuration script.\n\nThe script may be JavaScript (`.js`, `.cjs`, `.mjs`), Python (`.py`), or MoonBit (`.mbtx`), executed with Node.js, Python, or Moonrun respectively. MoonBit scripts are compiled to Wasm. Each script receives the process environment plus `MOON_MOD` (the module manifest path) and `MOON_BUILD_DIR` (a writable prebuild output directory created by Moon). `MOON_HOST_OS` and `MOON_HOST_ARCH` describe the Moon process's platform. `MOON_BACKEND`, `MOON_PROFILE`, and `MOON_JOBS` describe the project build. The original JSON input shape is still supplied on stdin for compatibility, with `paths.out_dir` set to the same output directory. Scripts return build configuration JSON on stdout. Since this is experimental, the API may change at any time without warning.",
      "type": [
        "string",
        "null"
      ]
    },
    "deps": {
      "description": "third-party dependencies of the module",
      "type": [
        "object",
        "null"
      ],
      "additionalProperties": {
        "$ref": "#/definitions/SourceDependencyInfo"
      }
    },
    "description": {
      "description": "description of this module",
      "type": [
        "string",
        "null"
      ]
    },
    "exclude": {
      "description": "Deprecated. Use `.gitignore` or `.moonignore` to control which files are packaged instead. `.moonignore` overrides `.gitignore` in the same directory.",
      "type": [
        "array",
        "null"
      ],
      "items": {
        "type": "string"
      }
    },
    "include": {
      "description": "Deprecated. Use `.gitignore` or `.moonignore` to control which files are packaged instead. `.moonignore` overrides `.gitignore` in the same directory.",
      "type": [
        "array",
        "null"
      ],
      "items": {
        "type": "string"
      }
    },
    "keywords": {
      "description": "keywords of this module",
      "type": [
        "array",
        "null"
      ],
      "items": {
        "type": "string"
      }
    },
    "license": {
      "description": "license of this module",
      "type": [
        "string",
        "null"
      ]
    },
    "name": {
      "description": "name of the module",
      "type": "string"
    },
    "preferred-target": {
      "description": "The preferred target backend of this module.\n\nToolchains are recommended to use this target as the default target when the user is not specifying or overriding in any other ways. However, this is merely a recommendation, and tools may deviate from this value at any time.",
      "type": [
        "string",
        "null"
      ]
    },
    "private": {
      "description": "Optional boolean selecting private visibility when true. When published, a private module must be accessible only to authorized users. Omit this field or set it to false for public visibility.",
      "type": "boolean"
    },
    "readme": {
      "description": "path to module's README file",
      "type": [
        "string",
        "null"
      ]
    },
    "repository": {
      "description": "url to module's repository",
      "type": [
        "string",
        "null"
      ]
    },
    "rule": {
      "description": "Rules that can be referenced by package-level `dev_build` entries.",
      "anyOf": [
        {
          "$ref": "#/definitions/MoonModJSONRules"
        },
        {
          "type": "null"
        }
      ]
    },
    "scripts": {
      "description": "Scripts related to the current module.",
      "type": [
        "object",
        "null"
      ],
      "additionalProperties": {
        "type": "string"
      }
    },
    "source": {
      "description": "source code directory of this module",
      "type": [
        "string",
        "null"
      ]
    },
    "supported-targets": {
      "description": "Supported backend set for all packages in this module.\n\nThis uses the same expression/list grammar as `moon.pkg.json`.",
      "anyOf": [
        {
          "$ref": "#/definitions/SupportedTargetsConfig"
        },
        {
          "type": "null"
        }
      ]
    },
    "version": {
      "description": "version of the module",
      "type": [
        "string",
        "null"
      ]
    },
    "warn-list": {
      "description": "Warn list setting of the module",
      "type": [
        "string",
        "null"
      ]
    }
  },
  "definitions": {
    "MoonModJSONRules": {
      "anyOf": [
        {
          "$ref": "#/definitions/MoonModRule"
        },
        {
          "type": "array",
          "items": {
            "$ref": "#/definitions/MoonModRule"
          }
        }
      ]
    },
    "MoonModRule": {
      "type": "object",
      "required": [
        "command",
        "name"
      ],
      "properties": {
        "command": {
          "type": "string"
        },
        "name": {
          "type": "string"
        }
      }
    },
    "SourceDependencyInfo": {
      "description": "Information about a specific dependency. This supports both simple string syntax and detailed object syntax in `moon.mod.json`.",
      "anyOf": [
        {
          "type": "string"
        },
        {
          "$ref": "#/definitions/SourceLocalDependencyInfo"
        },
        {
          "$ref": "#/definitions/SourceRegistryDependencyInfo"
        }
      ]
    },
    "SourceLocalDependencyInfo": {
      "type": "object",
      "required": [
        "path"
      ],
      "properties": {
        "path": {
          "type": "string"
        },
        "version": {
          "type": "string"
        }
      },
      "additionalProperties": false
    },
    "SourceRegistryDependencyInfo": {
      "type": "object",
      "properties": {
        "version": {
          "type": "string"
        }
      },
      "additionalProperties": false
    },
    "SupportedTargetsConfig": {
      "anyOf": [
        {
          "type": "string"
        },
        {
          "type": "array",
          "items": {
            "type": "string"
          }
        }
      ]
    }
  }
}