{
  "name": "username/hello",
  "version": "0.1.0",
  "readme": "README.md",
  "repository": "https://github.com",
  "license": "MIT",
  "keywords": [],
  "description": "",
  "source": "src",
  "exclude": [
    "test/a/a.txt",
    "*.mbt",
    "*.txt"
  ],
  "include": [
    "moon.mod.json",
    "*.mbt",
    "*.txt"
  ]
}
